{
  "schemaId": "cd-collab.log_time_candidate.v1",
  "evidenceId": "22222222-2222-4222-8222-222222222222",
  "relativePath": "worker/batch.log",
  "rotationFamily": "worker/batch.log",
  "parserId": "cd-collab.timestamp_shape",
  "parserVersion": "1",
  "sourceOffset": 84,
  "sourceLine": 3,
  "originalText": "2024-03-10 02:30:00",
  "parseClass": "local_ambiguous",
  "precision": "second",
  "explicitOffset": null,
  "confidenceUnknownReason": "ambiguous_timezone"
}
